{
  "schema": "treatcode.challenge_manifest.v1",
  "version": 1,
  "source_of_truth": "CHALLENGE_MANIFEST.json",
  "facet_dimensions": {
    "domain": [
      "algorithms",
      "architecture",
      "concurrency",
      "language-tools",
      "logic",
      "memory-safety",
      "numerical",
      "security"
    ],
    "technique": [
      "atomic-coordination",
      "balanced-arithmetic",
      "constant-time-computation",
      "data-structures",
      "fused-accumulate",
      "instruction-selection",
      "interpreter-and-compiler",
      "migration",
      "ownership-and-borrowing",
      "three-way-reasoning",
      "tritwise",
      "vector-dot-product",
      "width-polymorphism",
      "word-parallel",
      "t1",
      "ptr-t-s-",
      "own-t-",
      "t40",
      "tldr",
      "splitbuf",
      "vec-sort",
      "tst",
      "heap",
      "montgomery",
      "mmu",
      "match",
      "ptr",
      "own",
      "tcmp",
      "base-27",
      "q13-13",
      "bigint",
      "atomic",
      "epoch",
      "msd-radix",
      "huffman",
      "skip-list",
      "interval-tree",
      "tsel",
      "hensel-lifting",
      "feistel",
      "trit-shift",
      "register-allocation",
      "strength-reduction",
      "peephole",
      "vmac",
      "tritwidth",
      "esolang"
    ],
    "data_model": [
      "balanced-integer",
      "collections",
      "scalar-trit",
      "shared-state",
      "streams",
      "validated-pointers",
      "vectors",
      "word-parallel-trits"
    ],
    "stack_layer": [
      "compiler",
      "isa",
      "language",
      "library"
    ],
    "target": [
      "tasm",
      "tcl"
    ],
    "optimization_objective": [
      "constant-time",
      "correctness",
      "latency",
      "representation-dependent-cost",
      "safety",
      "throughput"
    ]
  },
  "challenges": [
    {
      "id": "T001",
      "title": "Three-Way Sign Test",
      "lifecycle": "published",
      "difficulty": "easy",
      "category": "three-valued",
      "tags": [
        "T1",
        "match"
      ],
      "facets": {
        "domain": [
          "logic"
        ],
        "technique": [
          "three-way-reasoning",
          "t1"
        ],
        "data_model": [
          "scalar-trit"
        ],
        "stack_layer": [
          "language"
        ],
        "target": [
          "tcl"
        ],
        "optimization_objective": [
          "correctness"
        ]
      },
      "description": "Given a `t40` value `x`, return its ternary sign — `-1` if negative, `0` if zero, `+1` if positive.\n\n### Constraints\n- Do not use `if` statements. The three-arm `match` construct is the intended solution mechanism. All three arms must be present.\n\n### Examples\n- `sign_test(-42)` → `-1`\n- `sign_test(0)` → `0`\n- `sign_test(99)` → `+1`",
      "signature": "fn sign_test(x: t40) -> t40",
      "template": "// T001 — Three-Way Sign Test\n// Given a t40 value, return:\n//   -1  if x is negative\n//    0  if x is zero\n//   +1  if x is positive\n//\n// Constraint: no if statements.\n// Use the native three-arm match.\n\nimport ulib;\n\nfn sign_test(x: t40) -> t40 {\n    // your solution here\n    \n}",
      "stats": {
        "solved": true,
        "submissions": 2841,
        "acceptance": 94,
        "points": 50
      },
      "execution": {
        "mode": "verified",
        "runner": "tcl-vm",
        "limits": {
          "time_ms": 2000,
          "memory_kib": 65536,
          "max_cycles": 250000,
          "max_output_bytes": 8192
        },
        "correctness": {
          "kind": "deterministic-vm-contract",
          "test_cases": [
            {
              "arg": -42,
              "expected_r13": -1
            },
            {
              "arg": 0,
              "expected_r13": 0
            },
            {
              "arg": 99,
              "expected_r13": 1
            },
            {
              "arg": -1,
              "expected_r13": -1
            },
            {
              "arg": 1,
              "expected_r13": 1
            }
          ],
          "wrapper": {
            "kind": "call",
            "template": "\n${code}\n\nfn main() -> t40 {\n    var res: t40 = sign_test(${arg});\n    return res;\n}\n"
          }
        }
      },
      "source_refs": [
        {
          "path": "treatcode/server.ts",
          "symbol": "challenge execution routes"
        },
        {
          "path": "treatcode/src/App.tsx",
          "symbol": "challenge lifecycle presentation"
        }
      ]
    },
    {
      "id": "T002",
      "title": "Ternary FizzBuzz",
      "lifecycle": "published",
      "difficulty": "easy",
      "category": "three-valued",
      "tags": [
        "T1",
        "match",
        "arithmetic"
      ],
      "facets": {
        "domain": [
          "logic"
        ],
        "technique": [
          "three-way-reasoning",
          "t1"
        ],
        "data_model": [
          "scalar-trit"
        ],
        "stack_layer": [
          "language"
        ],
        "target": [
          "tcl"
        ],
        "optimization_objective": [
          "correctness"
        ]
      },
      "description": "Given an integer `N`, print numbers from `1` to `N` (inclusive).\n    \nFor each number `i`:\n- If `i` is a multiple of 3, print `\"Trit\"` followed by a newline.\n- Otherwise, print `i` followed by a newline (using `sys_write_int` and `sys_newline`).\n\n### Constraints\n- `1 <= N <= 50`\n\n### Example Output for N = 5\n```text\n1\n2\nTrit\n4\n5\n```",
      "signature": "fn multiples_of_three(n: t40) -> t40",
      "template": "// T002 — Ternary FizzBuzz\n// Given an integer n, print numbers from 1 to n (inclusive).\n// For each number i:\n//   - If i is a multiple of 3, print \"Trit\" followed by a newline.\n//   - Otherwise, print i followed by a newline.\n//\n// Use: print_char(c) or print_string(str) or sys_write_char(c) or sys_write_int(val) or sys_newline()\n\nimport ulib;\n\nfn multiples_of_three(n: t40) -> t40 {\n    var i: t40 = 1;\n    while n - i >= 0 {\n        // Your code here:\n        \n        i = i + 1;\n    }\n    return 0;\n}",
      "stats": {
        "solved": true,
        "submissions": 2103,
        "acceptance": 91,
        "points": 50
      },
      "execution": {
        "mode": "verified",
        "runner": "tcl-vm",
        "limits": {
          "time_ms": 2000,
          "memory_kib": 65536,
          "max_cycles": 250000,
          "max_output_bytes": 8192
        },
        "correctness": {
          "kind": "deterministic-vm-contract",
          "test_cases": [
            {
              "arg": 5,
              "expected_output": "1\n2\nTrit\n4\n5\n"
            },
            {
              "arg": 12,
              "expected_output": "1\n2\nTrit\n4\n5\nTrit\n7\n8\nTrit\n10\n11\nTrit\n"
            }
          ],
          "wrapper": {
            "kind": "call",
            "template": "\n${code}\n\nfn main() -> t40 {\n    multiples_of_three(${arg});\n    return 0;\n}\n"
          }
        }
      },
      "source_refs": [
        {
          "path": "treatcode/server.ts",
          "symbol": "challenge execution routes"
        },
        {
          "path": "treatcode/src/App.tsx",
          "symbol": "challenge lifecycle presentation"
        }
      ]
    },
    {
      "id": "T003",
      "title": "Three-State Machine",
      "lifecycle": "draft",
      "difficulty": "easy",
      "category": "three-valued",
      "tags": [
        "T1",
        "enum"
      ],
      "facets": {
        "domain": [
          "logic"
        ],
        "technique": [
          "three-way-reasoning",
          "t1"
        ],
        "data_model": [
          "scalar-trit"
        ],
        "stack_layer": [
          "language"
        ],
        "target": [
          "tcl"
        ],
        "optimization_objective": [
          "correctness"
        ]
      },
      "description": "Design a simple finite state machine using three-valued logic state values. (Compile Check Only Mode)",
      "signature": "fn main() -> t40",
      "template": "// T003 — Three-State Machine\nimport ulib;\n\nfn main() -> t40 {\n    // your solution here\n    return 0;\n}",
      "stats": {
        "solved": false,
        "submissions": 1654,
        "acceptance": 88,
        "points": 50
      },
      "execution": {
        "mode": "compile-only",
        "runner": "tcl-vm",
        "limits": {
          "time_ms": 2000,
          "memory_kib": 65536,
          "max_cycles": 250000,
          "max_output_bytes": 8192
        }
      },
      "source_refs": [
        {
          "path": "treatcode/server.ts",
          "symbol": "challenge execution routes"
        },
        {
          "path": "treatcode/src/App.tsx",
          "symbol": "challenge lifecycle presentation"
        }
      ]
    },
    {
      "id": "T004",
      "title": "Null Pointer Safety Chain",
      "lifecycle": "draft",
      "difficulty": "medium",
      "category": "pointer-safety",
      "tags": [
        "ptr<T,S>",
        "match"
      ],
      "facets": {
        "domain": [
          "memory-safety"
        ],
        "technique": [
          "ownership-and-borrowing",
          "ptr-t-s-"
        ],
        "data_model": [
          "validated-pointers"
        ],
        "stack_layer": [
          "language"
        ],
        "target": [
          "tcl"
        ],
        "optimization_objective": [
          "safety"
        ]
      },
      "description": "Safely traverse a chain of pointers, handling any null pointer states securely. (Compile Check Only Mode)",
      "signature": "fn main() -> t40",
      "template": "// T004 — Null Pointer Safety Chain\nimport ulib;\n\nfn main() -> t40 {\n    // your solution here\n    return 0;\n}",
      "stats": {
        "solved": false,
        "submissions": 892,
        "acceptance": 67,
        "points": 150
      },
      "execution": {